{
  "$schema": "https://json-schema.org/draft/2020-12/schema",
  "$id": "https://github.com/Click-Scale-Agency/packaging-navigator/data/schema/country.schema.json",
  "title": "EU Packaging Hub — Country EPR data",
  "$defs": {
    "provenance": {
      "type": "object",
      "additionalProperties": false,
      "required": ["status"],
      "description": "Per-fact provenance: verification status, the specific source for THIS fact, when it was checked, and its validity window. Attach to individual tariffs/obligations rather than relying on the country-level `verified` boolean.",
      "properties": {
        "status": {
          "type": "string",
          "enum": [
            "official",
            "operator_published",
            "secondary_source",
            "inferred",
            "unverified",
            "not_applicable",
            "unknown"
          ],
          "description": "official = primary law/government source; operator_published = PRO/scheme price list; secondary_source = reputable third party; inferred = derived from PPWR/interpretation, no country-specific source; unverified = not yet checked; not_applicable = fact does not exist for this country (e.g. no public per-material tariff); unknown = open question."
        },
        "sourceUrl": { "type": "string", "format": "uri", "description": "The specific source backing THIS fact (may differ from country-level sources)." },
        "checkedAt": { "type": "string", "format": "date" },
        "validFrom": { "type": "string", "format": "date", "description": "Start of the tariff/obligation validity period." },
        "validTo": { "type": "string", "format": "date", "description": "End of validity, if known/bounded." },
        "note": { "type": "string" }
      }
    }
  },
  "type": "object",
  "additionalProperties": false,
  "required": ["code", "name", "register", "pro", "sources", "verified", "lastReviewed"],
  "properties": {
    "code": {
      "type": "string",
      "pattern": "^[A-Z]{2}$",
      "description": "ISO 3166-1 alpha-2"
    },
    "name": {
      "type": "object",
      "additionalProperties": false,
      "required": ["lv", "en"],
      "properties": {
        "lv": { "type": "string" },
        "en": { "type": "string" },
        "native": { "type": "string" }
      }
    },
    "competentAuthority": {
      "type": "string",
      "description": "National competent authority/regulator (analogous to register.operator; regulatory context, not a fee claim)"
    },
    "legalBasis": {
      "type": "string",
      "description": "National legal basis for packaging EPR (e.g. 'VerpackG; VerpackDG from 12.08.2026'). Compiled from project research + cross-checks."
    },
    "register": {
      "type": "object",
      "additionalProperties": false,
      "required": ["exists"],
      "properties": {
        "exists": {
          "type": "boolean",
          "description": "Does a dedicated national PACKAGING producer register exist? (LV: false as of 2026; IE: false — Repak membership instead)"
        },
        "name": { "type": "string" },
        "url": { "type": "string", "format": "uri" },
        "operator": { "type": "string", "description": "Authority/body running the register" },
        "numberFormat": { "type": "string", "description": "e.g. 'DE + 13 digits'" },
        "numberOnInvoices": { "type": "boolean" },
        "arRequiredForForeignSellers": {
          "type": ["boolean", "null"],
          "description": "Authorised representative required for sellers without local establishment; null = unverified"
        },
        "registrationCostEur": { "type": ["number", "null"] },
        "notes": { "type": "string" },
        "provenance": { "$ref": "#/$defs/provenance", "description": "Provenance of the register facts (exists/name/url/format)." },
        "arProvenance": { "$ref": "#/$defs/provenance", "description": "Provenance of the authorised-representative obligation (often `inferred` from PPWR Art. 45 rather than a country-specific source)." }
      },
      "if": { "properties": { "exists": { "const": true } } },
      "then": { "required": ["exists", "name", "url"] }
    },
    "pro": {
      "type": "object",
      "additionalProperties": false,
      "required": ["membershipRequired", "schemes"],
      "properties": {
        "membershipRequired": {
          "type": ["boolean", "string"],
          "description": "true / false / 'state-run' (e.g. HR pays Fund directly)"
        },
        "schemes": {
          "type": "array",
          "items": {
            "type": "object",
            "additionalProperties": false,
            "required": ["name", "url"],
            "properties": {
              "name": { "type": "string" },
              "url": { "type": "string", "format": "uri" },
              "tariffUrl": { "type": "string", "format": "uri" }
            }
          }
        },
        "rates": {
          "type": "object",
          "description": "Indicative household-packaging rates in EUR per kg. null = no reliable data.",
          "additionalProperties": false,
          "properties": {
            "paper": { "type": ["number", "null"], "minimum": 0 },
            "plastic": { "type": ["number", "null"], "minimum": 0 },
            "glass": { "type": ["number", "null"], "minimum": 0 },
            "metal": { "type": ["number", "null"], "minimum": 0 },
            "wood": { "type": ["number", "null"], "minimum": 0 },
            "composite": { "type": ["number", "null"], "minimum": 0 }
          }
        },
        "tariffYear": { "type": ["integer", "null"], "minimum": 2024, "maximum": 2035 },
        "minAnnualFeeEur": { "type": ["number", "null"], "minimum": 0 },
        "ecoModulation": { "type": "string", "description": "Short note on bonus/malus system if notable" },
        "ratesProvenance": { "$ref": "#/$defs/provenance", "description": "Provenance of the per-material PRO rates (e.g. operator_published from a price-list PDF, or not_applicable when schemes price by private contract)." }
      }
    },
    "extraTaxes": {
      "type": "array",
      "description": "Separate national taxes outside the EPR scheme (ES plastic excise, HU termékdíj, EE pakendiaktsiis...)",
      "items": {
        "type": "object",
        "additionalProperties": false,
        "required": ["name", "summary"],
        "properties": {
          "name": { "type": "string" },
          "summary": { "type": "string" },
          "rate": { "type": "string", "description": "Human-readable, e.g. '€0.45/kg non-recycled plastic'" },
          "material": {
            "type": ["string", "null"],
            "enum": ["paper", "plastic", "glass", "metal", "wood", "composite", null],
            "description": "Material this tax targets, used by the calculator. Explicit is preferred over guessing from the summary text."
          },
          "appliesConditionally": {
            "type": "boolean",
            "description": "true = liability is unresolved for a foreign B2C distance seller (e.g. ES plastic excise). The calculator surfaces it as a 'verify' caveat and never auto-adds it to a total."
          },
          "collectedBy": { "type": "string" },
          "url": { "type": "string", "format": "uri" },
          "provenance": { "$ref": "#/$defs/provenance" }
        }
      }
    },
    "thresholds": {
      "type": "object",
      "additionalProperties": false,
      "properties": {
        "deMinimis": { "type": "string", "description": "e.g. '0 kg — first unit triggers duty' or 'full obligations from 50,000 kg/yr'" }
      }
    },
    "reporting": {
      "type": "object",
      "additionalProperties": false,
      "description": "How and when packaging volumes must be declared in this country.",
      "properties": {
        "frequency": { "type": "string", "description": "e.g. 'annual', 'quarterly', 'annual + monthly plastic-tax return'" },
        "deadlines": {
          "type": "array",
          "items": { "type": "string" },
          "description": "Human-readable filing deadlines, e.g. 'Annual declaration by 31 March for the previous year'."
        },
        "zeroDeclaration": { "type": ["boolean", "null"], "description": "Must a nil return be filed even with zero volume? null = unknown." },
        "correction": { "type": "string", "description": "Correction/amendment procedure for past periods." },
        "note": { "type": "string" },
        "provenance": { "$ref": "#/$defs/provenance" }
      }
    },
    "statutoryFallback": {
      "type": "object",
      "additionalProperties": false,
      "description": "Statutory per-material rates that apply as an ALTERNATIVE to a PRO contract (e.g. LV DRN full rates when there is no scheme membership). The calculator computes this as a separate scenario and MUST NEVER sum it together with PRO fees — the two are mutually exclusive.",
      "required": ["name", "rates"],
      "properties": {
        "name": { "type": "string", "description": "e.g. 'Dabas resursu nodoklis (DRN) — pilnās likmes'" },
        "appliesWhen": { "type": "string", "description": "The condition under which these rates apply, e.g. 'Ja nav līguma ar licencētu apsaimniekotāju'." },
        "rates": {
          "type": "object",
          "additionalProperties": false,
          "description": "Statutory rates in EUR per kg. null = no rate for this material.",
          "properties": {
            "paper": { "type": ["number", "null"], "minimum": 0 },
            "plastic": { "type": ["number", "null"], "minimum": 0 },
            "glass": { "type": ["number", "null"], "minimum": 0 },
            "metal": { "type": ["number", "null"], "minimum": 0 },
            "wood": { "type": ["number", "null"], "minimum": 0 },
            "composite": { "type": ["number", "null"], "minimum": 0 }
          }
        },
        "tariffYear": { "type": ["integer", "null"], "minimum": 2024, "maximum": 2035 },
        "collectedBy": { "type": "string" },
        "url": { "type": "string", "format": "uri" },
        "note": { "type": "string" },
        "provenance": { "$ref": "#/$defs/provenance" }
      }
    },
    "drs": {
      "type": "object",
      "additionalProperties": false,
      "description": "Deposit-return system for beverage containers (separate from packaging EPR).",
      "properties": {
        "active": { "type": ["boolean", "null"], "description": "true = live beverage DRS in 2026; false = none/planned; null = unknown" },
        "operator": { "type": "string" },
        "deposit": { "type": "string", "description": "Human-readable deposit, e.g. '€0.10/container'" },
        "url": { "type": "string", "format": "uri" },
        "note": { "type": "string" },
        "provenance": { "$ref": "#/$defs/provenance" }
      }
    },
    "notes": { "type": "string" },
    "sources": {
      "type": "array",
      "minItems": 1,
      "items": {
        "type": "object",
        "additionalProperties": false,
        "required": ["url", "checkedAt"],
        "properties": {
          "url": { "type": "string", "format": "uri" },
          "title": { "type": "string" },
          "checkedAt": { "type": "string", "format": "date" },
          "official": { "type": "boolean", "description": "true = government/register/PRO primary source" }
        }
      }
    },
    "verified": {
      "type": "boolean",
      "description": "true only when register URL fetched AND rates come from an official tariff source. CI must reject verified:true without at least one sources[].official === true."
    },
    "lastReviewed": { "type": "string", "format": "date" }
  }
}
