{
  "code": "DK",
  "name": {
    "lv": "Dānija",
    "en": "Denmark",
    "native": "Danmark"
  },
  "competentAuthority": "Dānijas Vides aizsardzības aģentūra; Dansk Producentansvar (DPA)",
  "legalBasis": "Bekendtgørelse (rīkojums) Nr. 1146/2025 par iepakojumu un EPR",
  "register": {
    "exists": true,
    "name": "DPA producer register (all streams)",
    "url": "https://www.producentansvar.dk",
    "operator": "Dansk Producentansvar (DPA)",
    "arRequiredForForeignSellers": true,
    "registrationCostEur": null,
    "notes": "Site fetched 2026-08-16: 'Companies that put products subject to producer responsibility for packaging on the market in Denmark, must register in the producer register.' Single register for all EPR streams; registration via virk.dk; annual DPA fees based on reported volumes (fee page not parsed). AR for foreign (non-established) sellers is mandatory under PPWR Art. 45 from 12.08.2026 (not separately restated on the DPA page)."
  },
  "pro": {
    "membershipRequired": true,
    "schemes": [
      {
        "name": "VANA (collective packaging scheme)",
        "url": "https://www.vana.dk",
        "tariffUrl": "https://www.vana.dk/medlemskab/priser/vanas-grundpriser/"
      }
    ],
    "rates": {
      "paper": 0.214,
      "plastic": 0.681,
      "glass": 0.605,
      "metal": 1.022,
      "wood": 1.691,
      "composite": 0.829
    },
    "tariffYear": 2026,
    "minAnnualFeeEur": null,
    "ecoModulation": "Bonus/malus = 35% of operational costs by recyclability level: e.g. household plastic 4.68 (green) / 5.09 (base) / 6.75 (red) DKK/kg; yellow level billed at base price with any bonus refunded later."
  },
  "extraTaxes": [],
  "notes": "Rates from VANA's official grundpriser tables valid from 01.08.2026 (fetched as images 2026-08-16), household (husholdning) base prices for producers >8 t/yr, converted at 7.48 DKK/EUR (2026-08-16): cardboard (pap) 1.60 DKK/kg → 0.214 ('paper'; paper 'papir' only 0.27 → 0.036), plastic 5.09 → 0.681, glass 4.52 → 0.605, metal (ferrous+alu) 7.64 → 1.022, wood 12.64 → 1.691, food & drink cartons (MDK) 6.20 → 0.829 ('composite'); textiles/porcelain/cork/ceramics/other 0.27 → 0.036. IMPORTANT for small sellers: producers under 8 t/yr pay a flat combined rate — household 3.81 DKK/kg ≈ 0.510 €/kg, commercial 3.40 ≈ 0.455 (quarterly invoicing). Commercial (erhverv) table differs strongly (e.g. metal only 1.22 DKK/kg). VANA invoices in DKK — EUR values are indicative conversions.",
  "drs": {
    "active": true,
    "operator": "Dansk Retursystem",
    "note": "Sen izveidota depozīta sistēma pudelēm un bundžām."
  },
  "sources": [
    {
      "url": "https://www.producentansvar.dk",
      "title": "Dansk Producentansvar (DPA) — producer register (fetched)",
      "checkedAt": "2026-08-16",
      "official": true
    },
    {
      "url": "https://www.vana.dk/medlemskab/priser/vanas-grundpriser/",
      "title": "VANA — grundpriser from 01.08.2026 (official price tables, fetched)",
      "checkedAt": "2026-08-16",
      "official": true
    }
  ],
  "verified": true,
  "lastReviewed": "2026-08-16"
}
