{
  "code": "PL",
  "name": {
    "lv": "Polija",
    "en": "Poland",
    "native": "Polska"
  },
  "register": {
    "exists": true,
    "name": "Rejestr-BDO",
    "url": "https://bdo.mos.gov.pl",
    "operator": "Ministry of Climate and Environment / marshal offices",
    "numberFormat": "9-digit BDO number",
    "numberOnInvoices": true,
    "arRequiredForForeignSellers": null,
    "registrationCostEur": null,
    "notes": "Portal fetched live 2026-08-16 (blocks some bots; reachable). BDO number must be obtained before trading and shown on invoices and waste documents. 2026 registration/annual fee: 200 PLN for micro-enterprises, 800 PLN for others (raised from 100/300 PLN; annual fee due by 28 February, non-payment leads to removal — confirmed on the Mazovia marshal office BIP notice). Annual fee is waived in the year the registration fee is paid."
  },
  "pro": {
    "membershipRequired": true,
    "schemes": [
      {
        "name": "Rekopol Organizacja Odzysku Opakowań",
        "url": "https://www.rekopol.pl"
      }
    ],
    "rates": {
      "paper": null,
      "plastic": null,
      "glass": null,
      "metal": null,
      "wood": null,
      "composite": null
    },
    "tariffYear": null,
    "minAnnualFeeEur": null,
    "ecoModulation": ""
  },
  "extraTaxes": [],
  "notes": "Rates intentionally null: Polish recovery organisations (organizacje odzysku) price by individual contract and publish no official tariff table; Rekopol site (fetched 2026-08-16) lists a 'dopłaty' service but no rates. Polish packaging EPR reform (ROP / new packaging act, draft UC100) still in progress as of Aug 2026 — re-check scheme landscape when the act passes.",
  "sources": [
    {
      "url": "https://bdo.mos.gov.pl",
      "title": "Rejestr-BDO — Polish waste database register (fetched live)",
      "checkedAt": "2026-08-16",
      "official": true
    },
    {
      "url": "https://bip.mazovia.pl/pl/bip/komunikaty/przedsiebiorco-pamietaj-o-oplacie-rocznej-za-wpis-w-rejestrze-bdo-za-2026-rok.html",
      "title": "Mazovia marshal office BIP — BDO annual fee 2026 (200/800 PLN, deadline 28.02)",
      "checkedAt": "2026-08-16",
      "official": true
    },
    {
      "url": "https://www.rekopol.pl",
      "title": "Rekopol — recovery organisation (no public tariff table)",
      "checkedAt": "2026-08-16",
      "official": true
    }
  ],
  "verified": false,
  "lastReviewed": "2026-08-16"
}
