{
  "code": "LT",
  "name": {
    "lv": "Lietuva",
    "en": "Lithuania",
    "native": "Lietuva"
  },
  "competentAuthority": "Vides aizsardzības aģentūra (AAA)",
  "legalBasis": "Iepakojuma un iepakojuma atkritumu apsaimniekošanas likums; Mokesčio už aplinkos teršimą likums",
  "register": {
    "exists": true,
    "name": "GPAIS (unified product/packaging register, 8 streams)",
    "url": "https://www.gpais.eu",
    "operator": "Environmental Protection Agency (AAA)",
    "arRequiredForForeignSellers": true,
    "registrationCostEur": null,
    "notes": "Registration and reporting in GPAIS are mandatory even at very small volumes."
  },
  "pro": {
    "membershipRequired": true,
    "schemes": [
      {
        "name": "Žaliasis taškas (Green Dot Lithuania)",
        "url": "https://www.zaliasistaskas.lt"
      }
    ],
    "rates": {
      "paper": null,
      "plastic": null,
      "glass": null,
      "metal": null,
      "wood": null,
      "composite": null
    },
    "tariffYear": null,
    "minAnnualFeeEur": null,
    "ecoModulation": ""
  },
  "extraTaxes": [
    {
      "name": "Mokestis už aplinkos teršimą pakuočių atliekomis",
      "summary": "Environmental pollution tax on packaging waste. Producers/importers are EXEMPT for the share of packaging that is actually recycled (in practice via a PRO such as Gamtos ateitis or Žaliasis taškas); the tax is effectively the penalty on the unmanaged share. Statutory rates (from 2025, reusable + recyclable single-use packaging, EUR/t): glass 279, plastic/PET 520, paper/cardboard 133, metal 186, wood 189, composite 520. Non-recyclable single-use is higher: glass 395, plastic 875, paper 188, metal 263, wood 225, composite 1200 EUR/t. The base rate is multiplied by an annual indexing coefficient (1.48 for 2026). Fetched from Gamtos ateitis legal-info page 2026-08-16.",
      "rate": "recyclable packaging EUR/t (×1.48 index for 2026): plastic 520, glass 279, paper 133, metal 186, wood 189, composite 520",
      "collectedBy": "VMI (State Tax Inspectorate) / Aplinkos ministerija",
      "url": "https://gamtosateitis.lt/teisine-informacija/apmokestinamosios-pakuotes-rusys-ir-mokescio-tarifai/"
    }
  ],
  "thresholds": {
    "deMinimis": "0 kg — obligations from the first unit"
  },
  "notes": "pro.rates left null: the figures above are the statutory pollution-TAX rates (the penalty/alternative to PRO compliance), not a PRO's own per-material management fee (tvarkymo įkainiai), which PROs price by contract. Compliance route: register in GPAIS (mandatory even at tiny volumes) and contract a licensed PRO (Gamtos ateitis, Žaliasis taškas) to recycle and thereby gain the tax exemption. From 2025 obligations can only be met by recycling (incineration no longer counts).",
  "drs": {
    "active": true,
    "operator": "Užstato sistemos administratorius (USAD)",
    "deposit": "€0.10/vienība",
    "note": "Kopš 2016."
  },
  "sources": [
    {
      "url": "https://www.gpais.eu",
      "title": "GPAIS — Lithuanian unified producer register",
      "checkedAt": "2026-08-16",
      "official": true
    },
    {
      "url": "https://gamtosateitis.lt/teisine-informacija/apmokestinamosios-pakuotes-rusys-ir-mokescio-tarifai/",
      "title": "Gamtos ateitis — taxable packaging types & pollution-tax tariffs (fetched)",
      "checkedAt": "2026-08-16",
      "official": true
    },
    {
      "url": "https://www.repax.io/epr-registers",
      "title": "EPR register overview (repax.io) — register name/coverage cross-check",
      "checkedAt": "2026-08-16",
      "official": false
    }
  ],
  "verified": false,
  "lastReviewed": "2026-08-16"
}
