{
  "code": "FI",
  "name": {
    "lv": "Somija",
    "en": "Finland",
    "native": "Suomi"
  },
  "competentAuthority": "Somijas Uzraudzības aģentūra (LVV)",
  "legalBasis": "Atkritumu likums 646/2011; Valdības dekrēts par iepakojumu 518/2014",
  "register": {
    "exists": true,
    "name": "Tuottajarekisteri (viens reģistrs, 8 plūsmas)",
    "url": "https://lvv.fi/en/environment/information-on-extended-producer-responsibility",
    "operator": "Lupa- ja valvontavirasto (LVV, Finnish Supervisory Agency)",
    "arRequiredForForeignSellers": true,
    "registrationCostEur": null,
    "notes": "Ražotāju reģistru parasti sauc par TURRe; tā publiskā dalībnieku meklēšana ir jatehuoltokompassi.fi/haetietoja/turre/ (apstiprināts 2026-08-16). LVV EPR lapa iegūta 2026-08-16 (LVV pārņēma no Pirkanmaa ELY 01.01.2026): EPR skaidri attiecas uz tālpārdevējiem, kuriem bez filiāles Somijā jāieceļ pilnvarotais pārstāvis; LVV iesaka iestāties ražotāju organizācijā, kas uzņemas juridiskos pienākumus uzņēmuma vārdā. Precīzs reģistra e-pakalpojuma ieejas punkts un iespējamās valsts maksas vēl jāatrod LVV apakšlapās."
  },
  "pro": {
    "membershipRequired": true,
    "schemes": [
      {
        "name": "Suomen Pakkauskierrätys RINKI (pakalpojumu sabiedrība)",
        "url": "https://rinkiin.fi",
        "tariffUrl": "https://rinkiin.fi/app/uploads/2025/10/2026-Price-List-SPT-ENG.pdf"
      },
      {
        "name": "Suomen Pakkaustuottajat (Somijas iepakojuma ražotāji)",
        "url": "https://suomenpakkaustuottajat.fi"
      }
    ],
    "rates": {
      "paper": 0.079,
      "plastic": 0.214,
      "glass": 0.076,
      "metal": 0.029,
      "wood": 0.002,
      "composite": 0.162
    },
    "tariffYear": 2026,
    "minAnnualFeeEur": 74,
    "ecoModulation": "Three recyclability classes per material (consumer packaging): plastic A mono 0.214 / B multi 0.274 / C difficult (incl. PVC, biodegradable, combination) 0.360 €/kg; fibre A 0.079 / B 0.162 / C 0.241; metal A 0.029 / C 0.063."
  },
  "extraTaxes": [],
  "notes": "Rates from the official Finnish Packaging Producers Ltd (SPT) 'Price list 2026' PDF on rinkiin.fi (fetched 2026-08-16), consumer packaging, detailed declaration, Class A (recyclable): paper fibre 0.079, plastic 0.214, glass 0.076, metal 0.029, wood 0.002, liquid carton (fibre class B) 0.162 €/kg ('composite'). B2B packaging is far cheaper (paper 0.003, plastic 0.065). Companies placing <50,000 kg/yr may use the light declaration form (flat: paper 0.102, plastic 0.238, metal 0.030, glass 0.076 €/kg consumer). Rinki business service fee 0.00199 €/kg, min €74/yr, max €3,890/yr; SPT registration fee €0. 2026 SUP fee list published later.",
  "drs": {
    "active": true,
    "operator": "Suomen Palautuspakkaus Oy (Palpa)",
    "note": "Sen izveidota depozīta sistēma."
  },
  "sources": [
    {
      "url": "https://lvv.fi/en/environment/information-on-extended-producer-responsibility",
      "title": "LVV — informācija par ražotāja paplašināto atbildību (iegūts)",
      "checkedAt": "2026-08-16",
      "official": true
    },
    {
      "url": "https://rinkiin.fi/app/uploads/2025/10/2026-Price-List-SPT-ENG.pdf",
      "title": "Suomen Pakkaustuottajat — cenrādis 2026 (oficiāls PDF, iegūts un apstrādāts)",
      "checkedAt": "2026-08-16",
      "official": true
    },
    {
      "url": "https://rinkiin.fi/en/producer-responsibility/price-lists/",
      "title": "Rinki — cenrāžu lapa",
      "checkedAt": "2026-08-16",
      "official": true
    },
    {
      "url": "https://jatehuoltokompassi.fi/haetietoja/turre/",
      "title": "TURRe — publiskā ražotāju reģistra (Tuottajarekisteri) meklēšana",
      "checkedAt": "2026-08-16",
      "official": true
    }
  ],
  "verified": true,
  "lastReviewed": "2026-08-16"
}
